name,body_part,equipment,gif_url,target,secondary_muscles,instructions,exercise_id
barbell rear lunge v. 2,upper legs,barbell,https://v2.exercisedb.io/image/DM8GPPjMywYk4y,glutes,"{quadriceps,hamstrings,calves}","{""Stand with your feet shoulder-width apart and hold a barbell across your upper back."",""Take a step backward with your right foot, landing on the ball of your foot."",""Bend both knees to lower your body until your left thigh is parallel to the ground."",""Push through your left heel to return to the starting position."",""Repeat with the other leg.""}",77
barbell revers wrist curl v. 2,lower arms,barbell,https://v2.exercisedb.io/image/R7NxEanJpvltm8,forearms,"{biceps,brachialis}","{""Sit on a bench with your feet flat on the ground and your knees bent."",""Hold a barbell with an overhand grip, palms facing down, and your hands shoulder-width apart."",""Rest your forearms on your thighs, allowing your wrists to hang off the edge."",""Keeping your forearms stationary, exhale and curl your wrists upward as far as possible."",""Hold the contracted position for a brief pause, then inhale and slowly lower the barbell back to the starting position."",""Repeat for the desired number of repetitions.""}",79
barbell standing rocking leg calf raise,lower legs,barbell,https://v2.exercisedb.io/image/swtHWVsDau9saO,calves,"{hamstrings,quadriceps}","{""Stand with your feet shoulder-width apart and hold a barbell across your upper back."",""Raise your heels off the ground as high as possible, balancing on the balls of your feet."",""Slowly lower your heels back down to the starting position."",""Repeat for the desired number of repetitions.""}",111
barbell reverse close-grip bench press,upper arms,barbell,https://v2.exercisedb.io/image/75BSM2j-IhL0A7,triceps,"{chest,shoulders}","{""Lie flat on a bench with your feet flat on the ground and your back pressed against the bench."",""Grasp the barbell with a reverse grip, hands shoulder-width apart."",""Lift the barbell off the rack and hold it directly above your chest with your arms fully extended."",""Slowly lower the barbell down towards your chest, keeping your elbows close to your body."",""Pause for a moment when the barbell is just above your chest."",""Push the barbell back up to the starting position, fully extending your arms."",""Repeat for the desired number of repetitions.""}",2187
barbell reverse curl,upper arms,barbell,https://v2.exercisedb.io/image/-99Sk6zRw09T1k,biceps,{forearms},"{""Stand up straight with your feet shoulder-width apart and hold a barbell with an overhand grip, palms facing down."",""Keep your upper arms stationary and exhale as you curl the barbell upward, contracting your biceps."",""Continue to raise the barbell until your biceps are fully contracted and the barbell is at shoulder level."",""Hold the contracted position for a brief pause as you squeeze your biceps."",""Inhale as you slowly lower the barbell back to the starting position, keeping your upper arms stationary."",""Repeat for the desired number of repetitions.""}",80
barbell reverse grip bent over row,back,barbell,https://v2.exercisedb.io/image/HJHLHyJQKeqVb8,upper back,"{biceps,forearms}","{""Stand with your feet shoulder-width apart and knees slightly bent."",""Hold a barbell with an overhand grip, palms facing down, and hands slightly wider than shoulder-width apart."",""Bend forward at the hips, keeping your back straight and chest up, until your torso is almost parallel to the floor."",""Pull the barbell towards your lower chest, squeezing your shoulder blades together."",""Pause for a moment at the top, then slowly lower the barbell back to the starting position."",""Repeat for the desired number of repetitions.""}",118
barbell reverse grip decline bench press,chest,barbell,https://v2.exercisedb.io/image/Dwv1m1OQYACS6a,pectorals,"{triceps,shoulders}","{""Lie on a decline bench with your feet secured and your head lower than your hips."",""Grasp the barbell with a reverse grip, slightly wider than shoulder-width apart."",""Unrack the barbell and lower it slowly towards your chest, keeping your elbows tucked in."",""Pause for a moment at the bottom, then push the barbell back up to the starting position."",""Repeat for the desired number of repetitions.""}",1256
barbell reverse grip incline bench press,chest,barbell,https://v2.exercisedb.io/image/9iLSFzqlnfKz7P,pectorals,"{triceps,shoulders}","{""Set up an incline bench at a 45-degree angle."",""Lie down on the bench with your feet flat on the ground."",""Grasp the barbell with a reverse grip, hands slightly wider than shoulder-width apart."",""Unrack the barbell and lower it slowly towards your chest, keeping your elbows tucked in."",""Pause for a moment when the barbell touches your chest."",""Push the barbell back up to the starting position, fully extending your arms."",""Repeat for the desired number of repetitions.""}",1257
barbell reverse grip incline bench row,back,barbell,https://v2.exercisedb.io/image/Z5QAuWzTMSTzdG,upper back,"{biceps,forearms}","{""Set up an incline bench at a 45-degree angle."",""Sit on the bench facing the backrest with your chest against it."",""Grab the barbell with a reverse grip (palms facing down) and hands slightly wider than shoulder-width apart."",""Keep your back straight and core engaged."",""Pull the barbell towards your upper abdomen, squeezing your shoulder blades together."",""Pause for a moment at the top of the movement."",""Slowly lower the barbell back to the starting position."",""Repeat for the desired number of repetitions.""}",1317
barbell reverse grip skullcrusher,upper arms,barbell,https://v2.exercisedb.io/image/OooAo86Ozp6coR,triceps,{forearms},"{""Lie flat on a bench with your feet flat on the ground and your head at the end of the bench."",""Hold the barbell with a reverse grip, palms facing towards your face, and your hands shoulder-width apart."",""Extend your arms straight up over your chest, keeping your elbows in and your wrists straight."",""Slowly lower the barbell towards your forehead by bending your elbows, keeping your upper arms stationary."",""Pause for a moment at the bottom, then extend your arms back up to the starting position."",""Repeat for the desired number of repetitions.""}",1721
barbell reverse preacher curl,upper arms,barbell,https://v2.exercisedb.io/image/zOay9CbulPAHPa,biceps,{forearms},"{""Sit on a preacher bench with your chest against the pad and your arms extended straight down, holding a barbell with an overhand grip."",""Keeping your upper arms stationary, exhale and curl the barbell upward while contracting your biceps."",""Continue to raise the barbell until your biceps are fully contracted and the barbell is at shoulder level."",""Hold the contracted position for a brief pause as you squeeze your biceps."",""Inhale and slowly lower the barbell back to the starting position."",""Repeat for the desired number of repetitions.""}",81
barbell reverse wrist curl,lower arms,barbell,https://v2.exercisedb.io/image/oN4Gc8mBUEUtpr,forearms,"{biceps,brachialis}","{""Sit on a bench with your feet flat on the ground and hold a barbell with an overhand grip, palms facing down."",""Rest your forearms on your thighs, allowing your wrists to hang off the edge."",""Slowly curl your wrists upward, bringing the barbell towards your body."",""Pause for a moment at the top, then slowly lower the barbell back down to the starting position."",""Repeat for the desired number of repetitions.""}",82
barbell rollerout,waist,barbell,https://v2.exercisedb.io/image/LQ1JSdvIUgUT7o,abs,"{""lower back""}","{""Kneel on the floor and hold a barbell with both hands, shoulder-width apart."",""Roll the barbell forward, extending your arms and keeping your core engaged."",""Continue rolling forward until your body is fully extended and your arms are overhead."",""Pause for a moment, then slowly roll the barbell back towards your knees, maintaining control."",""Repeat for the desired number of repetitions.""}",84
barbell rollerout from bench,waist,barbell,https://v2.exercisedb.io/image/lJXyXVkxw7hMNJ,abs,"{shoulders,triceps}","{""Start by kneeling on the floor with a barbell placed on a bench in front of you."",""Grasp the barbell with an overhand grip, slightly wider than shoulder-width apart."",""Keeping your core engaged and your back straight, slowly roll the barbell forward, extending your arms in front of you."",""Continue rolling the barbell forward until your body is fully extended and your arms are overhead."",""Pause for a moment at the fully extended position, then slowly roll the barbell back towards your body, returning to the starting position."",""Repeat for the desired number of repetitions.""}",83
barbell romanian deadlift,upper legs,barbell,https://v2.exercisedb.io/image/EUSYNLeKzg62lN,glutes,"{hamstrings,""lower back""}","{""Stand with your feet shoulder-width apart and your toes pointing forward."",""Hold the barbell with an overhand grip, hands slightly wider than shoulder-width apart."",""Bend at the hips, keeping your back straight and your knees slightly bent."",""Lower the barbell towards the ground, keeping it close to your body."",""Feel the stretch in your hamstrings as you lower the barbell."",""Once you feel a stretch in your hamstrings, push your hips forward and stand up straight."",""Squeeze your glutes at the top of the movement."",""Lower the barbell back down to the starting position and repeat for the desired number of repetitions.""}",85
barbell seated behind head military press,shoulders,barbell,https://v2.exercisedb.io/image/6vAT48bvEaHOnX,delts,"{triceps,""upper back""}","{""Sit on a bench with your back straight and feet flat on the ground."",""Hold the barbell with an overhand grip, slightly wider than shoulder-width apart."",""Lift the barbell off the rack and bring it down to shoulder level, behind your head."",""Press the barbell upward until your arms are fully extended."",""Lower the barbell back down to the starting position."",""Repeat for the desired number of repetitions.""}",86
barbell seated bradford rocky press,shoulders,barbell,https://v2.exercisedb.io/image/-tCba2s5oexQE4,delts,"{triceps,""upper back""}","{""Sit on a bench with your back straight and feet flat on the ground."",""Hold the barbell with an overhand grip, slightly wider than shoulder-width apart."",""Lift the barbell to shoulder height, keeping your elbows slightly bent and pointing forward."",""Press the barbell overhead, fully extending your arms."",""Lower the barbell back to shoulder height and repeat for the desired number of repetitions.""}",87
barbell seated calf raise,lower legs,barbell,https://v2.exercisedb.io/image/-i3lrHj7-TirvS,calves,"{hamstrings,quadriceps}","{""Sit on a bench with your feet flat on the floor and a barbell resting on your thighs."",""Place the balls of your feet on a raised platform, such as a block or step."",""Position the barbell across your thighs and hold it securely with your hands."",""Keeping your back straight and your core engaged, lift your heels off the ground by extending your ankles."",""Pause for a moment at the top, then slowly lower your heels back down to the starting position."",""Repeat for the desired number of repetitions.""}",88
barbell seated calf raise,lower legs,barbell,https://v2.exercisedb.io/image/05DAqLarDdP7u7,calves,{hamstrings},"{""Sit on a bench with your feet flat on the floor and a barbell resting on your thighs."",""Place the balls of your feet on a raised platform, such as a block or step."",""Lower your heels as far as possible, feeling a stretch in your calves."",""Raise your heels as high as possible, contracting your calves."",""Repeat for the desired number of repetitions.""}",1371
barbell seated close grip behind neck triceps extension,upper arms,barbell,https://v2.exercisedb.io/image/V7KT6RMfEkD2Ew,triceps,{shoulders},"{""Sit on a bench with your back straight and feet flat on the ground."",""Hold the barbell with a close grip behind your neck, palms facing forward."",""Keep your elbows close to your head and slowly lower the barbell towards the back of your head."",""Pause for a moment, then extend your arms back up to the starting position."",""Repeat for the desired number of repetitions.""}",1718
barbell seated close-grip concentration curl,upper arms,barbell,https://v2.exercisedb.io/image/pGpZLrGdZ4350a,biceps,{forearms},"{""Sit on a bench with your feet flat on the floor and hold a barbell with an underhand grip, hands shoulder-width apart."",""Rest your upper arms against your inner thighs, just above your knees, and let the barbell hang down in front of you."",""Keeping your upper arms stationary, exhale and curl the barbell up towards your shoulders, contracting your biceps."",""Hold the contracted position for a brief pause, then inhale and slowly lower the barbell back down to the starting position."",""Repeat for the desired number of repetitions.""}",89
barbell seated good morning,upper legs,barbell,https://v2.exercisedb.io/image/gwvaRHofwx2o3E,glutes,"{hamstrings,""lower back""}","{""Sit on a bench with your feet flat on the ground and a barbell resting on your upper back."",""Keep your back straight and your chest up."",""Slowly hinge forward at the hips, lowering your torso towards the ground."",""Pause for a moment at the bottom, then push through your heels to return to the starting position."",""Repeat for the desired number of repetitions.""}",90
barbell seated overhead press,shoulders,barbell,https://v2.exercisedb.io/image/Dv6DRGvYSJZjN3,delts,"{triceps,""upper back""}","{""Sit on a bench with your back straight and feet flat on the ground."",""Hold the barbell with an overhand grip, slightly wider than shoulder-width apart."",""Lift the barbell off the rack and bring it to shoulder level, with your elbows bent and palms facing forward."",""Press the barbell overhead by extending your arms fully."",""Pause for a moment at the top, then slowly lower the barbell back to shoulder level."",""Repeat for the desired number of repetitions.""}",91
barbell seated overhead triceps extension,upper arms,barbell,https://v2.exercisedb.io/image/CKTVWdmc0WzmKq,triceps,{shoulders},"{""Sit on a bench with your back straight and feet flat on the ground."",""Hold a barbell with an overhand grip, hands shoulder-width apart, and raise it overhead."",""Lower the barbell behind your head by bending your elbows, keeping your upper arms close to your head."",""Pause for a moment, then extend your arms to raise the barbell back to the starting position."",""Repeat for the desired number of repetitions.""}",92
barbell seated twist,waist,barbell,https://v2.exercisedb.io/image/JTye0UzjXNufOI,abs,"{obliques,""lower back""}","{""Sit on a flat bench with your feet flat on the ground and your knees bent."",""Hold a barbell with both hands in front of your chest, keeping your elbows slightly bent."",""Engage your core and slowly twist your torso to one side, keeping your back straight."",""Pause for a moment at the end of the twist, then slowly rotate back to the starting position."",""Repeat the twist to the other side."",""Continue alternating sides for the desired number of repetitions.""}",94
barbell shrug,back,barbell,https://v2.exercisedb.io/image/S9H2tGL8Wst4r0,traps,{shoulders},"{""Stand with your feet shoulder-width apart and hold a barbell in front of you with an overhand grip."",""Keep your arms straight and your back straight throughout the exercise."",""Lift your shoulders up towards your ears as high as possible, squeezing your traps at the top."",""Hold for a moment, then slowly lower your shoulders back down to the starting position."",""Repeat for the desired number of repetitions.""}",95
barbell side bent v. 2,waist,barbell,https://v2.exercisedb.io/image/q7ZX-zNZTt46dn,abs,"{obliques,""lower back""}","{""Stand with your feet shoulder-width apart and hold a barbell with both hands, palms facing down."",""Keep your back straight and core engaged throughout the exercise."",""Slowly bend your torso to the right side, lowering the barbell towards your right knee."",""Pause for a moment, then return to the starting position."",""Repeat the movement on the left side."",""Continue alternating sides for the desired number of repetitions.""}",96
barbell side split squat,upper legs,barbell,https://v2.exercisedb.io/image/P1r-5caMg1Ifzd,quads,"{glutes,hamstrings,calves}","{""Stand with your feet wider than shoulder-width apart, toes pointing slightly outward."",""Hold a barbell across your upper back, resting it on your traps."",""Engage your core and keep your chest up as you lower your body down into a squat position, bending at the knees and hips."",""As you lower, push your knees out to the sides and keep your weight on your heels."",""Lower until your thighs are parallel to the ground, then push through your heels to return to the starting position."",""Repeat for the desired number of repetitions.""}",98
barbell side split squat v. 2,upper legs,barbell,https://v2.exercisedb.io/image/zANqHmtHPgfXnc,quads,"{glutes,hamstrings,calves}","{""Stand with your feet wider than shoulder-width apart, toes pointing slightly outwards."",""Hold a barbell across your upper back, resting it on your shoulders."",""Take a big step to the side with your right foot, keeping your left foot planted."",""Bend your right knee and lower your body down into a squat position, keeping your chest up and your back straight."",""Push through your right heel to return to the starting position."",""Repeat on the other side, stepping out with your left foot."",""Continue alternating sides for the desired number of repetitions.""}",97
barbell single leg deadlift,upper legs,barbell,https://v2.exercisedb.io/image/59AMO4kxYnPEDM,glutes,"{hamstrings,""lower back""}","{""Stand with your feet hip-width apart, holding a barbell in front of your thighs with an overhand grip."",""Shift your weight onto your left foot and lift your right foot slightly off the ground."",""Hinge forward at the hips, keeping your back straight and your right leg extended behind you for balance."",""Lower the barbell towards the ground, keeping it close to your body and your left leg slightly bent."",""Pause for a moment at the bottom, then engage your glutes and hamstrings to lift your torso back up to the starting position."",""Repeat for the desired number of repetitions, then switch sides.""}",1756
barbell single leg split squat,upper legs,barbell,https://v2.exercisedb.io/image/JOD40Tsl14Jnxv,quads,"{glutes,hamstrings,calves}","{""Stand with your feet shoulder-width apart, holding a barbell across your upper back."",""Take a large step forward with one leg, keeping your torso upright."",""Lower your body by bending your front knee and hip, while keeping your back leg straight."",""Continue lowering until your front thigh is parallel to the ground."",""Pause for a moment, then push through your front heel to return to the starting position."",""Repeat for the desired number of repetitions, then switch legs.""}",99
barbell sitted alternate leg raise,waist,barbell,https://v2.exercisedb.io/image/gN36xNRifpvtoc,abs,"{""hip flexors""}","{""Sit on a bench with your back straight and hold a barbell across your thighs."",""Keeping your legs straight, lift one leg up as high as possible while keeping the other leg on the ground."",""Lower the raised leg back down and repeat with the other leg."",""Continue alternating legs for the desired number of repetitions.""}",2799
barbell sitted alternate leg raise (female),waist,barbell,https://v2.exercisedb.io/image/I1bfd5GgohxP4F,abs,"{""hip flexors"",quadriceps}","{""Sit on a bench with your back straight and hold a barbell across your thighs."",""Place your hands on the sides of the bench for support."",""Keeping your legs straight, lift one leg up as high as possible while keeping it parallel to the ground."",""Lower the leg back down and repeat with the other leg."",""Continue alternating legs for the desired number of repetitions.""}",2800
barbell skier,shoulders,barbell,https://v2.exercisedb.io/image/47V30sx0is04xQ,delts,"{triceps,core}","{""Stand with your feet shoulder-width apart and hold a barbell in front of your thighs with an overhand grip."",""Bend your knees slightly and hinge forward at the hips, keeping your back straight and chest up."",""Simultaneously lift the barbell up towards your shoulders while jumping slightly off the ground."",""As you reach the top of the movement, quickly reverse the motion and lower the barbell back down to the starting position."",""Repeat for the desired number of repetitions.""}",100
barbell speed squat,upper legs,barbell,https://v2.exercisedb.io/image/Rd1cFcl3oc0x68,glutes,"{quadriceps,hamstrings,calves}","{""Stand with your feet shoulder-width apart, toes slightly turned out."",""Hold the barbell across your upper back, resting it on your traps or rear delts."",""Engage your core and keep your chest up as you lower your hips back and down, as if sitting into a chair."",""Lower until your thighs are parallel to the ground, or as low as you can comfortably go."",""Drive through your heels to stand back up, squeezing your glutes at the top."",""Repeat for the desired number of repetitions.""}",101
barbell split squat v. 2,upper legs,barbell,https://v2.exercisedb.io/image/vU-9dtSgZWOpUf,quads,"{glutes,hamstrings,calves}","{""Start by standing with your feet shoulder-width apart, holding a barbell across your upper back."",""Take a large step forward with your right foot, keeping your torso upright."",""Lower your body by bending your knees and hips until your right thigh is parallel to the ground."",""Pause for a moment, then push through your right heel to return to the starting position."",""Repeat with your left leg forward for the desired number of repetitions.""}",2810
barbell squat (on knees),upper legs,barbell,https://v2.exercisedb.io/image/4OJBPrNShKP0po,quads,"{glutes,hamstrings,calves}","{""Start by kneeling on the ground with your knees hip-width apart and your toes pointing forward."",""Place a barbell across your shoulders, gripping it with an overhand grip and your hands slightly wider than shoulder-width apart."",""Engage your core and keep your chest lifted as you slowly lower your body down by bending your knees, keeping your back straight."",""Continue lowering until your thighs are parallel to the ground, or as low as you can comfortably go."",""Pause for a moment at the bottom, then push through your heels to return to the starting position."",""Repeat for the desired number of repetitions.""}",102
barbell squat jump step rear lunge,upper legs,barbell,https://v2.exercisedb.io/image/jrKUlxnx0W7GoB,quads,"{glutes,hamstrings,calves}","{""Start by standing with your feet shoulder-width apart, holding a barbell across your upper back."",""Lower your body into a squat position by bending your knees and pushing your hips back."",""Explode upwards, jumping off the ground as high as you can."",""Land softly on your feet and immediately step back with one leg into a reverse lunge."",""Lower your body down until your front thigh is parallel to the ground, keeping your back straight."",""Push through your front heel to return to the starting position."",""Repeat the jump and lunge sequence on the other leg."",""Continue alternating legs for the desired number of repetitions.""}",2798
barbell standing ab rollerout,waist,barbell,https://v2.exercisedb.io/image/Thy02qlFTac0Ea,abs,"{shoulders,""lower back""}","{""Stand upright with your feet shoulder-width apart and hold the barbell with both hands in front of your thighs."",""Engage your core and slowly roll the barbell down towards the ground, keeping your back straight and your arms extended."",""Continue rolling the barbell forward until your body is fully extended and your hands are directly above your head."",""Pause for a moment, then slowly roll the barbell back towards your thighs, maintaining control and keeping your core engaged."",""Repeat for the desired number of repetitions.""}",103
barbell standing back wrist curl,lower arms,barbell,https://v2.exercisedb.io/image/PSkhDfL3Tsa8xr,forearms,"{biceps,shoulders}","{""Stand up straight with your feet shoulder-width apart and hold a barbell with an overhand grip."",""Rest the barbell on the back of your hands with your palms facing down and your fingers pointing towards your body."",""Keeping your upper arms stationary, exhale and curl your wrists upwards as far as possible."",""Hold the contracted position for a brief pause, then inhale and slowly lower the barbell back to the starting position."",""Repeat for the desired number of repetitions.""}",104
barbell standing bradford press,shoulders,barbell,https://v2.exercisedb.io/image/VE0dTf6zON0Tjc,delts,"{triceps,""upper back""}","{""Stand with your feet shoulder-width apart and hold the barbell in front of your shoulders with an overhand grip."",""Press the barbell overhead, fully extending your arms."",""Lower the barbell back down to the starting position."",""Repeat for the desired number of repetitions.""}",105
barbell standing calf raise,lower legs,barbell,https://v2.exercisedb.io/image/YW8ePKLyGSSFuG,calves,"{hamstrings,glutes}","{""Stand with your feet shoulder-width apart and place a barbell across your upper back."",""Raise your heels off the ground as high as possible, using only your toes."",""Pause for a moment at the top, then slowly lower your heels back down to the starting position."",""Repeat for the desired number of repetitions.""}",1372
