name,body_part,equipment,gif_url,target,secondary_muscles,instructions,exercise_id
band straight leg deadlift,back,band,https://v2.exercisedb.io/image/XvA8rjfX0j5EvM,spine,"{hamstrings,glutes}","{""Stand with your feet shoulder-width apart and place the band around your feet."",""Hold the band with both hands, palms facing your body, and keep your arms straight."",""Engage your core and maintain a slight bend in your knees."",""Slowly hinge forward at your hips, keeping your back straight and chest lifted."",""Lower the band towards the ground while keeping your legs straight."",""Pause for a moment at the bottom, then squeeze your glutes and hamstrings to return to the starting position."",""Repeat for the desired number of repetitions.""}",1010
band twisting overhead press,shoulders,band,https://v2.exercisedb.io/image/R-7Z4yk9LsBJHE,delts,"{triceps,""upper back""}","{""Stand with your feet shoulder-width apart and place the band under your feet."",""Hold the band handles at shoulder height with your palms facing forward."",""Engage your core and press the band overhead, fully extending your arms."",""As you press, twist your torso to one side, keeping your hips stable."",""Pause for a moment at the top, then return to the starting position."",""Repeat the press and twist on the opposite side."",""Continue alternating sides for the desired number of repetitions.""}",1012
band two legs calf raise - (band under both legs) v. 2,lower legs,band,https://v2.exercisedb.io/image/rwQHZrGLvfby1B,calves,"{ankles,feet}","{""Stand with your feet shoulder-width apart and place a resistance band under both feet."",""Hold the ends of the band with your hands for stability."",""Raise your heels off the ground as high as possible, using your calves."",""Pause for a moment at the top, then slowly lower your heels back down to the starting position."",""Repeat for the desired number of repetitions.""}",1369
band underhand pulldown,back,band,https://v2.exercisedb.io/image/huePS8HgvPJfeb,lats,"{biceps,forearms}","{""Attach the band to a high anchor point, such as a pull-up bar or sturdy beam."",""Stand facing the anchor point with your feet shoulder-width apart."",""Grasp the band with an underhand grip, hands slightly wider than shoulder-width apart."",""Extend your arms fully overhead, keeping your elbows slightly bent."",""Engage your lats and pull the band down towards your chest, squeezing your shoulder blades together."",""Pause for a moment at the bottom of the movement, then slowly release the tension and return to the starting position."",""Repeat for the desired number of repetitions.""}",1013
band v-up,waist,band,https://v2.exercisedb.io/image/QIzUZrdeG7fNKG,abs,"{""hip flexors""}","{""Lie flat on your back with your legs straight and your arms extended overhead, holding the band."",""Engaging your abs, lift your legs and upper body off the ground simultaneously, reaching your hands towards your toes."",""Pause for a moment at the top, then slowly lower your legs and upper body back down to the starting position."",""Repeat for the desired number of repetitions.""}",1014
band vertical pallof press,waist,band,https://v2.exercisedb.io/image/2CBlyTV3tYG0qR,abs,"{obliques,glutes}","{""Stand with your feet shoulder-width apart and wrap the band around a sturdy object at chest height."",""Hold the band with both hands and step away from the anchor point, creating tension in the band."",""Position yourself perpendicular to the anchor point, with your side facing the band."",""Extend your arms straight out in front of you, keeping your hands at chest height."",""Engage your core and press the band away from your chest, fully extending your arms."",""Hold the position for a few seconds, then slowly bring the band back towards your chest."",""Repeat for the desired number of repetitions, then switch sides.""}",1015
band wrist curl,lower arms,band,https://v2.exercisedb.io/image/cD7zBiplwAIXnE,forearms,"{biceps,triceps}","{""Sit on a bench or chair with your feet flat on the ground."",""Hold the band with both hands, palms facing up, and rest your forearms on your thighs."",""Slowly curl your wrists upward, squeezing your forearms."",""Pause for a moment at the top, then slowly lower your wrists back down to the starting position."",""Repeat for the desired number of repetitions.""}",1016
band y-raise,shoulders,band,https://v2.exercisedb.io/image/dA-dXTfbR4a7t7,delts,"{traps,rhomboids}","{""Stand with your feet shoulder-width apart and hold the band in front of your thighs with your palms facing inwards."",""Keep your arms straight and lift them up and out to the sides, forming a 'Y' shape with your body."",""Squeeze your shoulder blades together at the top of the movement."",""Slowly lower your arms back down to the starting position."",""Repeat for the desired number of repetitions.""}",1017
barbell alternate biceps curl,upper arms,barbell,https://v2.exercisedb.io/image/Itfs8FlGvipwTE,biceps,{forearms},"{""Stand up straight with your feet shoulder-width apart and hold a barbell in each hand, palms facing forward."",""Keep your upper arms stationary and exhale as you curl the weights while contracting your biceps."",""Continue to raise the barbells until your biceps are fully contracted and the barbells are at shoulder level."",""Hold the contracted position for a brief pause as you squeeze your biceps."",""Inhale as you slowly begin to lower the barbells back to the starting position."",""Repeat for the desired number of repetitions, alternating arms.""}",23
barbell bench front squat,upper legs,barbell,https://v2.exercisedb.io/image/E2pBJjasFZRaU3,quads,"{hamstrings,glutes,calves}","{""Start by standing with your feet shoulder-width apart and the barbell resting on your upper chest, just below your collarbone."",""Hold the barbell with an overhand grip, keeping your elbows up and your upper arms parallel to the ground."",""Lower your body down into a squat position by bending at the knees and hips, keeping your back straight and your chest up."",""Pause for a moment at the bottom of the squat, then push through your heels to return to the starting position."",""Repeat for the desired number of repetitions.""}",24
barbell bench press,chest,barbell,https://v2.exercisedb.io/image/sDt3aoIxBkQQcj,pectorals,"{triceps,shoulders}","{""Lie flat on a bench with your feet flat on the ground and your back pressed against the bench."",""Grasp the barbell with an overhand grip slightly wider than shoulder-width apart."",""Lift the barbell off the rack and hold it directly above your chest with your arms fully extended."",""Lower the barbell slowly towards your chest, keeping your elbows tucked in."",""Pause for a moment when the barbell touches your chest."",""Push the barbell back up to the starting position by extending your arms."",""Repeat for the desired number of repetitions.""}",25
barbell bench squat,upper legs,barbell,https://v2.exercisedb.io/image/iQaoT5bL9QwwYN,quads,"{glutes,hamstrings,calves}","{""Set up a barbell on a squat rack at chest height."",""Stand facing away from the rack, with your feet shoulder-width apart."",""Bend your knees and lower your body down into a squat position, keeping your back straight and chest up."",""Grasp the barbell with an overhand grip, slightly wider than shoulder-width apart."",""Lift the barbell off the rack and step back, ensuring your feet are still shoulder-width apart."",""Lower your body down into a squat, keeping your knees in line with your toes."",""Pause for a moment at the bottom, then push through your heels to return to the starting position."",""Repeat for the desired number of repetitions.""}",26
barbell bent arm pullover,back,barbell,https://v2.exercisedb.io/image/dafu3Xx4vJoziI,lats,"{triceps,chest}","{""Lie flat on a bench with your head at one end and your feet on the floor."",""Hold a barbell with a shoulder-width grip and extend your arms straight above your chest."",""Lower the barbell behind your head while keeping your arms slightly bent."",""Pause for a moment, then raise the barbell back to the starting position."",""Repeat for the desired number of repetitions.""}",1316
barbell bent over row,back,barbell,https://v2.exercisedb.io/image/sO25JoSS4WjAsU,upper back,"{biceps,forearms}","{""Stand with your feet shoulder-width apart and knees slightly bent."",""Bend forward at the hips while keeping your back straight and chest up."",""Grasp the barbell with an overhand grip, hands slightly wider than shoulder-width apart."",""Pull the barbell towards your lower chest by retracting your shoulder blades and squeezing your back muscles."",""Pause for a moment at the top, then slowly lower the barbell back to the starting position."",""Repeat for the desired number of repetitions.""}",27
barbell biceps curl (with arm blaster),upper arms,barbell,https://v2.exercisedb.io/image/U47P9E8Ps1zJcL,biceps,{forearms},"{""Stand up straight with your feet shoulder-width apart and hold a barbell with an underhand grip, palms facing up."",""Place your upper arms against the arm blaster, keeping your elbows close to your torso."",""Keeping your upper arms stationary, exhale and curl the weights while contracting your biceps."",""Continue to raise the barbell until your biceps are fully contracted and the bar is at shoulder level."",""Hold the contracted position for a brief pause as you squeeze your biceps."",""Inhale and slowly begin to lower the barbell back to the starting position."",""Repeat for the desired number of repetitions.""}",2407
barbell clean and press,upper legs,barbell,https://v2.exercisedb.io/image/D6hR2mVl1vpEbh,quads,"{hamstrings,glutes,shoulders,triceps}","{""Stand with your feet shoulder-width apart and the barbell on the floor in front of you."",""Bend your knees and hinge at the hips to lower down and grip the barbell with an overhand grip, hands slightly wider than shoulder-width apart."",""Drive through your heels and extend your hips and knees to lift the barbell off the floor, keeping it close to your body."",""As the barbell reaches your thighs, explosively extend your hips, shrug your shoulders, and pull the barbell up towards your chest."",""As the barbell reaches chest height, quickly drop under it and catch it at shoulder level, with your elbows pointing forward and your palms facing up."",""From the catch position, press the barbell overhead by extending your arms and pushing the barbell straight up."",""Lower the barbell back down to the starting position and repeat for the desired number of repetitions.""}",28
barbell clean-grip front squat,upper legs,barbell,https://v2.exercisedb.io/image/rvojk5t4SaONHW,glutes,"{quadriceps,hamstrings,calves,core}","{""Start by standing with your feet shoulder-width apart and the barbell resting on your upper chest, with your elbows pointing forward."",""Lower your body by bending your knees and pushing your hips back, as if you are sitting back into a chair."",""Keep your chest up and your back straight as you lower down, making sure your knees do not go past your toes."",""Continue lowering until your thighs are parallel to the ground, or as low as you can comfortably go."",""Pause for a moment at the bottom, then push through your heels to stand back up, extending your hips and knees."",""Repeat for the desired number of repetitions.""}",29
barbell close-grip bench press,upper arms,barbell,https://v2.exercisedb.io/image/BSzKLTNFtnIRXm,triceps,"{chest,shoulders}","{""Lie flat on a bench with your feet flat on the ground and your back pressed against the bench."",""Grasp the barbell with a close grip, slightly narrower than shoulder-width apart."",""Unrack the barbell and lower it slowly towards your chest, keeping your elbows close to your body."",""Pause for a moment when the barbell touches your chest."",""Push the barbell back up to the starting position, fully extending your arms."",""Repeat for the desired number of repetitions.""}",30
barbell curl,upper arms,barbell,https://v2.exercisedb.io/image/3ri6S7vo5ydHaD,biceps,{forearms},"{""Stand up straight with your feet shoulder-width apart and hold a barbell with an underhand grip, palms facing forward."",""Keep your elbows close to your torso and exhale as you curl the weights while contracting your biceps."",""Continue to raise the bar until your biceps are fully contracted and the bar is at shoulder level."",""Hold the contracted position for a brief pause as you squeeze your biceps."",""Inhale as you slowly begin to lower the bar back to the starting position."",""Repeat for the desired number of repetitions.""}",31
barbell deadlift,upper legs,barbell,https://v2.exercisedb.io/image/okexdEq3lYoJRm,glutes,"{hamstrings,""lower back""}","{""Stand with your feet shoulder-width apart and the barbell on the ground in front of you."",""Bend your knees and hinge at the hips to lower your torso and grip the barbell with an overhand grip, hands slightly wider than shoulder-width apart."",""Keep your back straight and chest lifted as you drive through your heels to lift the barbell off the ground, extending your hips and knees."",""As you stand up straight, squeeze your glutes and keep your core engaged."",""Lower the barbell back down to the ground by bending at the hips and knees, keeping your back straight."",""Repeat for the desired number of repetitions.""}",32
barbell decline bench press,chest,barbell,https://v2.exercisedb.io/image/OL64KdLgbjZpbU,pectorals,"{triceps,shoulders}","{""Lie on a decline bench with your feet secured and your head lower than your hips."",""Grasp the barbell with an overhand grip slightly wider than shoulder-width apart."",""Unrack the barbell and lower it slowly towards your chest, keeping your elbows tucked in."",""Pause for a moment at the bottom, then push the barbell back up to the starting position."",""Repeat for the desired number of repetitions.""}",33
barbell decline bent arm pullover,back,barbell,https://v2.exercisedb.io/image/fvKRSyxuT9kGVe,lats,"{triceps,chest}","{""Lie down on a decline bench with your head lower than your hips and your feet secured."",""Hold a barbell with a pronated grip (palms facing away from you) and extend your arms straight above your chest."",""Lower the barbell behind your head in a controlled manner, keeping your arms slightly bent."",""Pause for a moment, then raise the barbell back to the starting position by contracting your lats."",""Repeat for the desired number of repetitions.""}",34
barbell decline close grip to skull press,upper arms,barbell,https://v2.exercisedb.io/image/pPI0QPHVHr5Zio,triceps,"{chest,shoulders}","{""Lie on a decline bench with your head lower than your feet and hold a barbell with a close grip."",""Lower the barbell towards your forehead by bending your elbows, keeping your upper arms stationary."",""Pause for a moment, then extend your arms to press the barbell back up to the starting position."",""Repeat for the desired number of repetitions.""}",35
barbell decline pullover,chest,barbell,https://v2.exercisedb.io/image/obc8m4-dbwHxBD,pectorals,"{triceps,shoulders}","{""Lie down on a decline bench with your head lower than your hips and your feet secured."",""Hold the barbell with a pronated grip (palms facing away from you) and your hands slightly wider than shoulder-width apart."",""Extend your arms above your chest, keeping a slight bend in your elbows."",""Lower the barbell in an arc motion behind your head, feeling a stretch in your chest and shoulders."",""Pause for a moment, then return the barbell to the starting position by reversing the motion."",""Repeat for the desired number of repetitions.""}",1255
barbell decline wide-grip press,chest,barbell,https://v2.exercisedb.io/image/WjoLH2KYV0Jhcb,pectorals,"{triceps,shoulders}","{""Lie on a decline bench with your feet secured and your head lower than your hips."",""Grasp the barbell with a wide grip, slightly wider than shoulder-width apart."",""Lower the barbell to your chest, keeping your elbows out to the sides."",""Push the barbell back up to the starting position, fully extending your arms."",""Repeat for the desired number of repetitions.""}",36
barbell decline wide-grip pullover,back,barbell,https://v2.exercisedb.io/image/IOn5Jf3OZu2iEn,lats,"{triceps,chest}","{""Lie on a decline bench with your head lower than your hips and your feet secured."",""Hold a barbell with a wide grip and extend your arms straight above your chest."",""Lower the barbell behind your head in a controlled manner, keeping your arms straight."",""Pause for a moment, then raise the barbell back to the starting position."",""Repeat for the desired number of repetitions.""}",37
barbell drag curl,upper arms,barbell,https://v2.exercisedb.io/image/dwliM7qxe6k4C5,biceps,{forearms},"{""Stand with your feet shoulder-width apart and hold a barbell with an underhand grip, palms facing up."",""Let the barbell hang at arm's length in front of your thighs."",""Keeping your upper arms stationary, curl the barbell up towards your chest by contracting your biceps."",""Pause for a moment at the top, then slowly lower the barbell back down to the starting position."",""Repeat for the desired number of repetitions.""}",38
barbell floor calf raise,lower legs,barbell,https://v2.exercisedb.io/image/HTMhrujhtGrU2V,calves,{hamstrings},"{""Place a barbell on the floor in front of you."",""Stand with the balls of your feet on the edge of the barbell, with your heels hanging off."",""Hold onto a stable object for balance if needed."",""Raise your heels as high as possible, using your calves to lift your body."",""Pause for a moment at the top, then slowly lower your heels back down to the starting position."",""Repeat for the desired number of repetitions.""}",1370
barbell jump squat,upper legs,barbell,https://v2.exercisedb.io/image/3ry8ehc8MREg57,glutes,"{quadriceps,hamstrings,calves}","{""Start by standing with your feet shoulder-width apart, holding a barbell across your upper back."",""Lower your body into a squat position by bending your knees and pushing your hips back."",""Once you reach the bottom of the squat, explode upwards by jumping off the ground."",""As you jump, extend your hips, knees, and ankles, pushing through your toes."",""Land softly back into the squat position and immediately repeat the movement for the desired number of repetitions.""}",53
barbell front chest squat,upper legs,barbell,https://v2.exercisedb.io/image/mU1q9lj92hVPAC,glutes,"{quadriceps,hamstrings,calves,core}","{""Start by standing with your feet shoulder-width apart, toes slightly turned out."",""Hold the barbell in front of your chest with your hands shoulder-width apart, elbows pointing forward."",""Engage your core and keep your chest up as you lower your body down into a squat position, pushing your hips back and bending your knees."",""Lower until your thighs are parallel to the ground, or as low as you can comfortably go."",""Pause for a moment at the bottom, then push through your heels to return to the starting position."",""Repeat for the desired number of repetitions.""}",39
barbell front raise,shoulders,barbell,https://v2.exercisedb.io/image/9GpxELUFAx35dg,delts,"{biceps,triceps}","{""Stand with your feet shoulder-width apart and hold a barbell in front of your thighs with an overhand grip."",""Keep your arms straight and lift the barbell forward and upward until it reaches shoulder level."",""Pause for a moment at the top, then slowly lower the barbell back down to the starting position."",""Repeat for the desired number of repetitions.""}",41
barbell front raise and pullover,chest,barbell,https://v2.exercisedb.io/image/qKxDNHIAX2g22p,pectorals,"{deltoids,triceps}","{""Stand with your feet shoulder-width apart and hold a barbell with an overhand grip, palms facing down."",""Keep your arms straight and raise the barbell in front of you until it reaches shoulder height."",""Pause for a moment at the top, then slowly lower the barbell back down to the starting position."",""Next, lower the barbell behind your head, keeping your arms straight."",""Pause for a moment at the bottom, then raise the barbell back up to the starting position."",""Repeat for the desired number of repetitions.""}",40
barbell front squat,upper legs,barbell,https://v2.exercisedb.io/image/UjfzC3RNmJthhi,glutes,"{quadriceps,hamstrings,calves,core}","{""Start by standing with your feet shoulder-width apart, toes slightly turned out."",""Hold the barbell in front of your shoulders, resting it on your collarbone and shoulders."",""Engage your core and keep your chest up as you lower your body down into a squat position, pushing your hips back and bending your knees."",""Lower until your thighs are parallel to the ground, or as low as you can comfortably go."",""Pause for a moment at the bottom, then push through your heels to return to the starting position."",""Repeat for the desired number of repetitions.""}",42
barbell full squat,upper legs,barbell,https://v2.exercisedb.io/image/SsUem8wF52nt5S,glutes,"{quadriceps,hamstrings,calves,core}","{""Stand with your feet shoulder-width apart, toes slightly turned out."",""Hold the barbell across your upper back, resting it on your traps or rear delts."",""Engage your core and keep your chest up as you begin to lower your body down."",""Bend at the knees and hips, pushing your hips back and down as if sitting into a chair."",""Lower yourself until your thighs are parallel to the ground or slightly below."",""Keep your knees in line with your toes and your weight in your heels."",""Drive through your heels to stand back up, extending your hips and knees."",""Repeat for the desired number of repetitions.""}",43
barbell full squat (back pov),upper legs,barbell,https://v2.exercisedb.io/image/z5iTPmNAlnT79Y,glutes,"{quadriceps,hamstrings,calves,core}","{""Stand with your feet shoulder-width apart, toes slightly turned out."",""Hold the barbell across your upper back, resting it on your traps or rear delts."",""Engage your core and keep your chest up as you begin to lower your body down."",""Bend at the knees and hips, pushing your hips back and down as if sitting into a chair."",""Lower your body until your thighs are parallel to the ground or slightly below."",""Keep your knees in line with your toes and your weight in your heels."",""Drive through your heels to stand back up, extending your hips and knees."",""Repeat for the desired number of repetitions.""}",1461
barbell full squat (side pov),upper legs,barbell,https://v2.exercisedb.io/image/7ewcpllq5WOQJo,glutes,"{quadriceps,hamstrings,calves,core}","{""Stand with your feet shoulder-width apart, toes slightly turned out."",""Hold the barbell across your upper back, resting it on your traps or rear delts."",""Engage your core and keep your chest up as you begin to lower your body down."",""Bend at the knees and hips, pushing your hips back and down as if sitting into a chair."",""Lower your body until your thighs are parallel to the ground or slightly below."",""Keep your knees in line with your toes and your weight in your heels."",""Drive through your heels to stand back up, extending your hips and knees."",""Repeat for the desired number of repetitions.""}",1462
barbell full zercher squat,upper legs,barbell,https://v2.exercisedb.io/image/OTSglO7JbZUB1v,glutes,"{quadriceps,hamstrings,calves,core}","{""Stand with your feet shoulder-width apart and toes slightly turned out."",""Hold the barbell in the crooks of your elbows, with your hands gripping the barbell for stability."",""Engage your core and keep your chest lifted as you lower your hips back and down into a squat position."",""Keep your knees in line with your toes and your weight in your heels."",""Lower until your thighs are parallel to the ground, or as low as you can comfortably go."",""Drive through your heels to stand back up, squeezing your glutes at the top of the movement."",""Repeat for the desired number of repetitions.""}",1545
barbell glute bridge,upper legs,barbell,https://v2.exercisedb.io/image/PQ9f-NJPIPGVTh,glutes,"{hamstrings,""lower back""}","{""Start by lying flat on your back on the ground with your knees bent and feet flat on the floor."",""Place a barbell across your hips, holding it securely with both hands."",""Engage your glutes and core muscles, then lift your hips off the ground until your body forms a straight line from your knees to your shoulders."",""Pause for a moment at the top, squeezing your glutes."",""Slowly lower your hips back down to the starting position."",""Repeat for the desired number of repetitions.""}",1409
barbell glute bridge two legs on bench (male),upper legs,barbell,https://v2.exercisedb.io/image/X6F-eVf5u1EK17,glutes,"{hamstrings,core}","{""Start by sitting on the edge of a bench with your upper back resting against it and your feet flat on the ground, hip-width apart."",""Place a barbell across your hips, holding it securely with both hands."",""Engage your glutes and core muscles, then press through your heels to lift your hips off the bench, creating a straight line from your knees to your shoulders."",""Pause for a moment at the top, squeezing your glutes."",""Slowly lower your hips back down to the starting position."",""Repeat for the desired number of repetitions.""}",3562
barbell good morning,upper legs,barbell,https://v2.exercisedb.io/image/yl10d4YGx9V4U0,hamstrings,"{""lower back""}","{""Start by standing with your feet shoulder-width apart and the barbell resting on your upper back."",""Keeping your back straight and your core engaged, hinge forward at the hips, pushing your buttocks back as if you were trying to touch the wall behind you with your glutes."",""Lower your torso until it is parallel to the ground, feeling a stretch in your hamstrings."",""Pause for a moment, then return to the starting position by squeezing your glutes and pushing your hips forward."",""Repeat for the desired number of repetitions.""}",44
