name,body_part,equipment,gif_url,target,secondary_muscles,instructions,exercise_id
cable high pulley overhead tricep extension,upper arms,cable,https://v2.exercisedb.io/image/dSRU6bxkTj55Ke,triceps,{shoulders},"{""Attach a rope to a high pulley and stand facing away from the machine."",""Grasp the rope with both hands and extend your arms overhead."",""Keep your elbows close to your head and your upper arms stationary."",""Slowly lower the rope behind your head by bending your elbows."",""Pause for a moment, then extend your arms back to the starting position."",""Repeat for the desired number of repetitions.""}",1722
cable high row (kneeling),back,cable,https://v2.exercisedb.io/image/oVEz2853KQ3PVl,upper back,"{biceps,shoulders}","{""Attach a straight bar to a cable machine at chest height."",""Kneel down in front of the cable machine and grab the bar with an overhand grip, hands shoulder-width apart."",""Sit back on your heels, keeping your back straight and your core engaged."",""Pull the bar towards your upper abdomen, squeezing your shoulder blades together."",""Pause for a moment at the top of the movement, then slowly release the bar back to the starting position."",""Repeat for the desired number of repetitions.""}",167
cable hip adduction,upper legs,cable,https://v2.exercisedb.io/image/UGcl9ykga2M9kd,adductors,"{glutes,quadriceps}","{""Attach the ankle cuff to your ankle and stand facing the cable machine."",""Position yourself far enough away from the machine so that there is tension on the cable."",""Place your hands on the machine for support."",""Keeping your leg straight, slowly move your leg across your body towards the midline."",""Pause for a moment at the end of the movement, then slowly return to the starting position."",""Repeat for the desired number of repetitions.""}",168
cable incline bench row,back,cable,https://v2.exercisedb.io/image/Oh0ArgpT8EMQEI,upper back,"{biceps,""rear deltoids""}","{""Set up an incline bench at a 45-degree angle and attach a cable handle to the low pulley."",""Sit on the bench facing the cable machine with your feet flat on the floor and your knees slightly bent."",""Grasp the cable handle with an overhand grip and extend your arms fully in front of you."",""Lean forward from your hips while keeping your back straight and your core engaged."",""Pull the cable handle towards your chest by retracting your shoulder blades and bending your elbows."",""Squeeze your back muscles at the top of the movement, then slowly extend your arms back to the starting position."",""Repeat for the desired number of repetitions.""}",1318
cable incline fly,chest,cable,https://v2.exercisedb.io/image/ZUMlMmgzfUgYPh,pectorals,"{deltoids,triceps}","{""Adjust the cable machine to a low position and attach the handles."",""Sit on an incline bench with your back against the pad and feet flat on the floor."",""Grasp the handles with an overhand grip and extend your arms straight out in front of you."",""Keeping a slight bend in your elbows, open your arms out to the sides in a controlled motion."",""Pause for a moment at the fully extended position, then slowly return to the starting position."",""Repeat for the desired number of repetitions.""}",171
cable incline fly (on stability ball),chest,cable,https://v2.exercisedb.io/image/96yMV2YtjmLewa,pectorals,"{deltoids,triceps}","{""Set up a stability ball at an incline angle."",""Attach the cable handles to the high pulleys of a cable machine."",""Sit on the stability ball facing away from the machine, with your feet firmly planted on the ground."",""Grasp the cable handles with an overhand grip, palms facing forward."",""Lean forward slightly, keeping your back straight and core engaged."",""With a controlled motion, bring your arms out to the sides, keeping a slight bend in your elbows."",""Continue the motion until your arms are parallel to the ground."",""Pause for a moment, then slowly return to the starting position."",""Repeat for the desired number of repetitions.""}",170
cable incline pushdown,back,cable,https://v2.exercisedb.io/image/OK5vzKp0F1uG6L,lats,"{triceps,shoulders}","{""Attach a straight bar to a high pulley cable machine."",""Stand facing away from the machine with your feet shoulder-width apart."",""Grasp the bar with an overhand grip, hands slightly wider than shoulder-width apart."",""Lean forward slightly and keep your back straight."",""Pull the bar down towards your thighs by extending your elbows."",""Pause for a moment at the bottom, then slowly return the bar to the starting position."",""Repeat for the desired number of repetitions.""}",172
cable incline triceps extension,upper arms,cable,https://v2.exercisedb.io/image/DDLNhOnmjnTiqZ,triceps,{shoulders},"{""Adjust the cable machine to a low pulley position."",""Attach a straight bar to the cable."",""Stand facing away from the machine with your feet shoulder-width apart."",""Grasp the bar with an overhand grip and extend your arms straight overhead."",""Lean forward slightly, keeping your back straight and core engaged."",""Bend your elbows and lower the bar behind your head, keeping your upper arms close to your ears."",""Pause for a moment, then extend your arms back to the starting position."",""Repeat for the desired number of repetitions.""}",173
cable judo flip,waist,cable,https://v2.exercisedb.io/image/mNmC9Nd8vx3UC8,abs,"{obliques,shoulders}","{""Stand facing the cable machine with your feet shoulder-width apart."",""Hold the cable handle with both hands at chest level, palms facing down."",""Engage your core and rotate your torso to the right, pulling the cable across your body."",""As you rotate, pivot your back foot and allow your hips to rotate naturally."",""Extend your arms fully and finish the movement by flipping the cable handle over your shoulder."",""Return to the starting position by reversing the movement, rotating your torso back to the center."",""Repeat the movement on the opposite side."",""Continue alternating sides for the desired number of repetitions.""}",174
cable kickback,upper arms,cable,https://v2.exercisedb.io/image/3YIcIEQwzXlYMA,triceps,{shoulders},"{""Stand facing a cable machine with your feet shoulder-width apart."",""Hold the cable handle with your right hand and step back to create tension in the cable."",""Bend your knees slightly and hinge forward at the hips, keeping your back straight."",""Keep your upper arm close to your body and your elbow bent at a 90-degree angle."",""Extend your forearm backward, straightening your arm fully."",""Pause for a moment, then slowly return to the starting position."",""Repeat for the desired number of repetitions, then switch sides.""}",860
cable kneeling crunch,waist,cable,https://v2.exercisedb.io/image/1hzonyptm-ieiv,abs,{obliques},"{""Attach a rope handle to a high pulley and kneel down facing away from the machine."",""Hold the rope handle with both hands and place it behind your head, keeping your elbows out to the sides."",""Keeping your hips stationary, flex your waist and crunch your torso down towards your thighs."",""Pause for a moment at the bottom, then slowly return to the starting position."",""Repeat for the desired number of repetitions.""}",175
cable kneeling rear delt row (with rope) (male),shoulders,cable,https://v2.exercisedb.io/image/EWf-C1WHtAK0Ge,delts,"{trapezius,rhomboids,biceps}","{""Attach a rope handle to a low cable pulley and kneel down facing the machine."",""Grasp the rope with a neutral grip (palms facing each other) and extend your arms fully in front of you."",""Keeping your back straight and core engaged, pull the rope towards your body by retracting your shoulder blades."",""Squeeze your shoulder blades together at the end of the movement and hold for a brief pause."",""Slowly release the tension and return to the starting position."",""Repeat for the desired number of repetitions.""}",3697
cable kneeling triceps extension,upper arms,cable,https://v2.exercisedb.io/image/6D31zGf6JyYz-p,triceps,{shoulders},"{""Attach a rope handle to a high pulley and kneel down facing the cable machine."",""Grasp the rope with a neutral grip (palms facing each other) and bring your hands to the sides of your head."",""Keep your elbows close to your head and your upper arms stationary throughout the exercise."",""Extend your forearms by contracting your triceps until your arms are fully extended."",""Pause for a moment, then slowly return to the starting position by bending your elbows."",""Repeat for the desired number of repetitions.""}",176
cable lat pulldown full range of motion,back,cable,https://v2.exercisedb.io/image/VPG2X37LOOrfX7,lats,"{biceps,rhomboids,""rear deltoids""}","{""Sit on the lat pulldown machine with your knees positioned under the pads."",""Grasp the cable bar with an overhand grip, slightly wider than shoulder-width apart."",""Lean back slightly and keep your chest up, maintaining a slight arch in your lower back."",""Pull the bar down towards your upper chest, squeezing your shoulder blades together."",""Pause for a moment at the bottom of the movement, then slowly release the bar back to the starting position."",""Repeat for the desired number of repetitions.""}",2330
cable lateral pulldown (with rope attachment),back,cable,https://v2.exercisedb.io/image/cZdaJKiNkVl2T2,lats,"{biceps,forearms}","{""Attach a rope attachment to the cable machine at a high position."",""Stand facing the machine with your feet shoulder-width apart."",""Grasp the rope with an overhand grip, palms facing each other."",""Keep your back straight and lean slightly back."",""Pull the rope down towards your sides, squeezing your shoulder blades together."",""Pause for a moment at the bottom of the movement."",""Slowly release the tension and allow the rope to return to the starting position."",""Repeat for the desired number of repetitions.""}",177
cable lateral pulldown with v-bar,back,cable,https://v2.exercisedb.io/image/pLZkoQ-gDUdVRr,lats,"{biceps,forearms}","{""Sit down on the cable pulldown machine and grab the v-bar attachment with an overhand grip."",""Adjust the knee pad so that your thighs are secured under it."",""Keep your back straight and lean back slightly."",""Pull the v-bar down towards your upper chest while keeping your elbows close to your body."",""Squeeze your back muscles at the bottom of the movement."",""Slowly return the v-bar to the starting position and repeat for the desired number of repetitions.""}",2616
cable lateral raise,shoulders,cable,https://v2.exercisedb.io/image/LcwsUEcp6LoY5g,delts,"{traps,triceps}","{""Stand with your feet shoulder-width apart and grasp the cable handles with an overhand grip."",""Keep your arms straight and your core engaged."",""Raise your arms out to the sides until they are parallel to the floor."",""Pause for a moment at the top, then slowly lower your arms back down to the starting position."",""Repeat for the desired number of repetitions.""}",178
cable low fly,chest,cable,https://v2.exercisedb.io/image/J0IlTX8Bi8BrjO,pectorals,"{deltoids,triceps}","{""Attach the handles to the low pulleys of a cable machine and select an appropriate weight."",""Stand in the middle of the machine with your feet shoulder-width apart and a slight bend in your knees."",""Grasp the handles with an overhand grip and extend your arms out to the sides, keeping a slight bend in your elbows."",""Maintaining control, slowly bring your arms forward in a sweeping motion, crossing them in front of your body."",""Pause for a moment at the peak of the movement, feeling the stretch in your chest muscles."",""Reverse the motion and slowly return your arms to the starting position, keeping tension on your chest muscles throughout."",""Repeat for the desired number of repetitions.""}",179
cable low seated row,back,cable,https://v2.exercisedb.io/image/dqw1mGbUPDPRNq,upper back,"{biceps,forearms}","{""Sit on the machine with your feet flat on the footrests and your knees slightly bent."",""Grasp the handles with an overhand grip, palms facing down."",""Keep your back straight and lean slightly forward, maintaining a slight bend in your elbows."",""Pull the handles towards your body, squeezing your shoulder blades together."",""Pause for a moment at the peak of the movement, then slowly release the handles back to the starting position."",""Repeat for the desired number of repetitions.""}",180
cable lying bicep curl,upper arms,cable,https://v2.exercisedb.io/image/GmUpe84nXIsYR1,biceps,{forearms},"{""Attach a straight bar to a low pulley cable machine."",""Lie face up on a flat bench with your feet flat on the ground."",""Grasp the bar with an underhand grip, hands shoulder-width apart."",""Extend your arms fully, keeping your elbows close to your sides."",""Keeping your upper arms stationary, exhale and curl the bar up towards your shoulders."",""Pause for a moment at the top, squeezing your biceps."",""Inhale and slowly lower the bar back to the starting position, fully extending your arms."",""Repeat for the desired number of repetitions.""}",1634
cable lying close-grip curl,upper arms,cable,https://v2.exercisedb.io/image/yvsPNhGc9PCms7,biceps,{forearms},"{""Attach a straight bar to a low pulley cable machine."",""Lie face up on a flat bench with your feet flat on the ground."",""Grasp the bar with an underhand grip, hands shoulder-width apart."",""Extend your arms fully, keeping your elbows close to your sides."",""Keeping your upper arms stationary, curl the bar towards your chest by contracting your biceps."",""Pause for a moment at the top, squeezing your biceps."",""Slowly lower the bar back to the starting position, fully extending your arms."",""Repeat for the desired number of repetitions.""}",182
cable lying extension pullover (with rope attachment),back,cable,https://v2.exercisedb.io/image/nqC-A7INHDjrwp,lats,"{triceps,shoulders}","{""Attach a rope to a cable machine and set the pulley at the highest position."",""Lie down on a bench with your head towards the cable machine."",""Hold the rope with both hands and extend your arms straight up above your chest."",""Keeping your arms straight, slowly lower the rope behind your head while maintaining control."",""Pause for a moment at the bottom, then slowly raise the rope back to the starting position."",""Repeat for the desired number of repetitions.""}",184
cable lying fly,chest,cable,https://v2.exercisedb.io/image/hp5ww87pY41sLF,pectorals,"{deltoids,triceps}","{""Attach the handles to the cables and lie flat on a bench with your feet flat on the ground."",""Hold the handles with your palms facing each other and your arms extended straight above your chest."",""Keeping a slight bend in your elbows, lower your arms out to the sides in a wide arc until you feel a stretch in your chest."",""Pause for a moment, then squeeze your chest muscles to bring your arms back to the starting position."",""Repeat for the desired number of repetitions.""}",185
cable lying triceps extension v. 2,upper arms,cable,https://v2.exercisedb.io/image/P4F74OErEHUcDC,triceps,{shoulders},"{""Attach a rope handle to a low pulley cable machine."",""Lie down on a flat bench facing up, with your head towards the cable machine."",""Grasp the rope handle with both hands, palms facing each other, and extend your arms straight up over your chest."",""Keeping your upper arms stationary, slowly lower the rope handle towards your forehead by bending your elbows."",""Pause for a moment at the bottom, then extend your arms back up to the starting position."",""Repeat for the desired number of repetitions.""}",186
cable middle fly,chest,cable,https://v2.exercisedb.io/image/S53yLCwu0pWCC3,pectorals,"{deltoids,triceps}","{""Attach cables to both sides of a cable machine at chest height."",""Stand in the center of the machine with one foot slightly in front of the other."",""Grasp the handles with an overhand grip and extend your arms out to the sides."",""Keep a slight bend in your elbows and maintain a slight forward lean."",""Engage your chest muscles and bring your arms forward in a sweeping motion."",""Pause for a moment at the center, then slowly return your arms back to the starting position."",""Repeat for the desired number of repetitions.""}",188
cable one arm bent over row,back,cable,https://v2.exercisedb.io/image/UdD9irICEihmXm,upper back,"{biceps,forearms}","{""Stand facing a cable machine with your feet shoulder-width apart."",""Bend your knees slightly and hinge forward at the hips, keeping your back straight."",""Grasp the cable handle with one hand, palm facing inward, and extend your arm fully."",""Pull the cable handle towards your body, keeping your elbow close to your side, until your hand reaches your lower chest."",""Pause for a moment, then slowly extend your arm back to the starting position."",""Repeat for the desired number of repetitions, then switch sides.""}",189
cable one arm curl,upper arms,cable,https://v2.exercisedb.io/image/evsHkgZqZat4ZY,biceps,{forearms},"{""Stand facing the cable machine with your feet shoulder-width apart."",""Grasp the cable handle with an underhand grip, palm facing up."",""Keep your elbow close to your side and slowly curl your forearm up towards your shoulder."",""Pause for a moment at the top, then slowly lower your forearm back down to the starting position."",""Repeat for the desired number of repetitions.""}",190
cable one arm decline chest fly,chest,cable,https://v2.exercisedb.io/image/zPAkvvT10hIJ40,pectorals,"{shoulders,triceps}","{""Attach a D-handle to a low pulley cable machine and set the bench to a decline angle."",""Lie down on the bench with your head towards the machine and grab the handle with your right hand."",""Extend your arm straight up above your chest, keeping a slight bend in your elbow."",""With a controlled motion, lower your arm out to the side until your hand is in line with your shoulder."",""Pause for a moment, then reverse the motion and bring your arm back to the starting position."",""Repeat for the desired number of repetitions, then switch to your left arm and repeat the exercise.""}",1262
cable one arm fly on exercise ball,chest,cable,https://v2.exercisedb.io/image/OWppNl0vDuWV5Z,pectorals,"{deltoids,triceps}","{""Sit on an exercise ball with your feet flat on the ground and your back straight."",""Hold a cable handle in one hand and extend your arm out to the side, parallel to the ground."",""Keep your elbow slightly bent and your palm facing forward."",""Slowly bring your arm across your body, squeezing your chest muscles."",""Pause for a moment at the end of the movement, then slowly return to the starting position."",""Repeat for the desired number of repetitions, then switch sides.""}",1263
cable one arm incline fly on exercise ball,chest,cable,https://v2.exercisedb.io/image/BY7YKkmXqEGTgh,pectorals,"{deltoids,triceps}","{""Sit on an exercise ball with your feet flat on the ground and your back against an incline bench."",""Hold a cable handle in one hand with your arm extended and palm facing inward."",""Keeping a slight bend in your elbow, slowly lower your arm out to the side until your hand is in line with your shoulder."",""Pause for a moment, then squeeze your chest muscles to bring your arm back to the starting position."",""Repeat for the desired number of repetitions, then switch arms.""}",1264
cable one arm incline press,chest,cable,https://v2.exercisedb.io/image/1lHl2vLmgcCZsk,pectorals,"{deltoids,triceps}","{""Adjust the cable machine to a low pulley position."",""Sit on an incline bench facing away from the cable machine."",""Grasp the handle with one hand and bring it up to shoulder height."",""Position your feet firmly on the ground and maintain a stable position."",""Press the handle forward and upward, extending your arm fully."",""Pause for a moment at the top, then slowly lower the handle back to the starting position."",""Repeat for the desired number of repetitions, then switch sides.""}",1265
cable one arm incline press on exercise ball,chest,cable,https://v2.exercisedb.io/image/yInzAp0Uq-ZWVR,pectorals,"{shoulders,triceps}","{""Sit on an exercise ball with your feet flat on the ground and your back resting against an incline bench."",""Hold a cable handle in one hand and position your arm at a 90-degree angle with your elbow bent."",""Press the cable handle forward and upward, extending your arm fully."",""Pause for a moment at the top, then slowly lower the cable handle back to the starting position."",""Repeat for the desired number of repetitions, then switch to the other arm.""}",1266
cable one arm lateral bent-over,chest,cable,https://v2.exercisedb.io/image/rpS5VwzucPyG1L,pectorals,"{deltoids,trapezius}","{""Stand with your feet shoulder-width apart, facing a cable machine."",""Grasp the handle with one hand and step back to create tension on the cable."",""Bend forward at the waist, keeping your back straight and your core engaged."",""Extend your arm out to the side, parallel to the ground, with a slight bend in your elbow."",""Slowly bring your arm back to the starting position, maintaining control throughout the movement."",""Repeat for the desired number of repetitions, then switch sides.""}",191
cable one arm lateral raise,shoulders,cable,https://v2.exercisedb.io/image/2nLmagFV7jfQe2,delts,"{traps,triceps}","{""Stand with your feet shoulder-width apart, facing the cable machine."",""Hold the cable handle with one hand, palm facing down, and stand far enough away from the machine so that there is tension on the cable."",""Keep your arm straight and slowly raise it out to the side until it is parallel to the ground."",""Pause for a moment at the top, then slowly lower your arm back down to the starting position."",""Repeat for the desired number of repetitions, then switch sides.""}",192
cable one arm preacher curl,upper arms,cable,https://v2.exercisedb.io/image/7Nsot-Qhz55LxJ,biceps,{forearms},"{""Adjust the cable machine so that the preacher curl pad is at chest height."",""Stand facing the cable machine with your feet shoulder-width apart."",""Grasp the cable handle with an underhand grip and position your upper arm against the preacher curl pad."",""Keep your back straight and your core engaged."",""Slowly curl the cable handle towards your shoulder, keeping your upper arm against the pad."",""Pause for a moment at the top of the movement, squeezing your biceps."",""Slowly lower the cable handle back to the starting position."",""Repeat for the desired number of repetitions."",""Switch arms and repeat the exercise.""}",1633
cable one arm pulldown,back,cable,https://v2.exercisedb.io/image/YO5qqmnzI4aCH1,lats,"{biceps,forearms}","{""Attach a single handle to a high pulley cable machine."",""Stand facing the machine with your feet shoulder-width apart."",""Grasp the handle with an overhand grip and extend your arm fully."",""Keep your back straight and your core engaged."",""Pull the handle down towards your side while keeping your elbow close to your body."",""Pause for a moment at the bottom of the movement, squeezing your lat muscle."",""Slowly release the handle back to the starting position."",""Repeat for the desired number of repetitions."",""Switch sides and repeat the exercise with the other arm.""}",3563
cable one arm reverse preacher curl,upper arms,cable,https://v2.exercisedb.io/image/EWv1349XIak6Vk,biceps,{forearms},"{""Adjust the cable machine so that the pulley is at the lowest position."",""Stand facing the cable machine with your feet shoulder-width apart."",""Grasp the cable handle with an underhand grip and position your upper arm against the preacher bench pad."",""Keep your back straight and your core engaged throughout the exercise."",""Slowly curl your forearm towards your bicep, keeping your upper arm stationary against the pad."",""Pause for a moment at the top of the movement, squeezing your bicep."",""Slowly lower the cable handle back to the starting position."",""Repeat for the desired number of repetitions."",""Switch arms and repeat the exercise.""}",1635
cable one arm straight back high row (kneeling),back,cable,https://v2.exercisedb.io/image/rBagFvwUncMBTl,upper back,"{biceps,shoulders}","{""Attach a handle to a cable machine at waist height."",""Kneel down facing the cable machine and grab the handle with one hand."",""Keep your back straight and your core engaged."",""Pull the handle towards your chest, squeezing your shoulder blades together."",""Pause for a moment at the top of the movement."",""Slowly release the handle back to the starting position."",""Repeat for the desired number of repetitions."",""Switch sides and repeat the exercise with the other arm.""}",193
cable one arm tricep pushdown,upper arms,cable,https://v2.exercisedb.io/image/55XOM8Y7aRjE6W,triceps,{forearms},"{""Stand facing a cable machine with a straight bar attachment at chest height."",""Grasp the bar with an overhand grip and step back to create tension in the cable."",""Position your feet shoulder-width apart and slightly bend your knees."",""Keep your back straight and core engaged throughout the exercise."",""Start with your arm fully extended and perpendicular to the floor."",""Keeping your upper arm stationary, exhale and push the bar down until your arm is fully extended."",""Pause for a moment, then inhale and slowly return to the starting position."",""Repeat for the desired number of repetitions, then switch arms.""}",1723
