name,body_part,equipment,gif_url,target,secondary_muscles,instructions,exercise_id
3/4 sit-up,waist,body weight,https://v2.exercisedb.io/image/MTX4DIOEUXALPg,abs,"{""hip flexors"",""lower back""}","{""Lie flat on your back with your knees bent and feet flat on the ground."",""Place your hands behind your head with your elbows pointing outwards."",""Engaging your abs, slowly lift your upper body off the ground, curling forward until your torso is at a 45-degree angle."",""Pause for a moment at the top, then slowly lower your upper body back down to the starting position."",""Repeat for the desired number of repetitions.""}",1
45° side bend,waist,body weight,https://v2.exercisedb.io/image/abQYrvOGL38dSR,abs,{obliques},"{""Stand with your feet shoulder-width apart and your arms extended straight down by your sides."",""Keeping your back straight and your core engaged, slowly bend your torso to one side, lowering your hand towards your knee."",""Pause for a moment at the bottom, then slowly return to the starting position."",""Repeat on the other side."",""Continue alternating sides for the desired number of repetitions.""}",2
air bike,waist,body weight,https://v2.exercisedb.io/image/HLJGly65Iljjyn,abs,"{""hip flexors""}","{""Lie flat on your back with your hands placed behind your head."",""Lift your legs off the ground and bend your knees at a 90-degree angle."",""Bring your right elbow towards your left knee while simultaneously straightening your right leg."",""Return to the starting position and repeat the movement on the opposite side, bringing your left elbow towards your right knee while straightening your left leg."",""Continue alternating sides in a pedaling motion for the desired number of repetitions.""}",3
all fours squad stretch,upper legs,body weight,https://v2.exercisedb.io/image/OXRk59eCaDysAb,quads,"{hamstrings,glutes}","{""Start on all fours with your hands directly under your shoulders and your knees directly under your hips."",""Extend one leg straight back, keeping your knee bent and your foot flexed."",""Slowly lower your hips towards the ground, feeling a stretch in your quads."",""Hold this position for 20-30 seconds."",""Switch legs and repeat the stretch on the other side.""}",1512
alternate heel touchers,waist,body weight,https://v2.exercisedb.io/image/4o9B07lz-2rsS-,abs,{obliques},"{""Lie flat on your back with your knees bent and feet flat on the ground."",""Extend your arms straight out to the sides, parallel to the ground."",""Engaging your abs, lift your shoulders off the ground and reach your right hand towards your right heel."",""Return to the starting position and repeat on the left side, reaching your left hand towards your left heel."",""Continue alternating sides for the desired number of repetitions.""}",6
alternate lateral pulldown,back,cable,https://v2.exercisedb.io/image/6uLZ9RvXBbEQCf,lats,"{biceps,rhomboids}","{""Sit on the cable machine with your back straight and feet flat on the ground."",""Grasp the handles with an overhand grip, slightly wider than shoulder-width apart."",""Lean back slightly and pull the handles towards your chest, squeezing your shoulder blades together."",""Pause for a moment at the peak of the movement, then slowly release the handles back to the starting position."",""Repeat for the desired number of repetitions.""}",7
ankle circles,lower legs,body weight,https://v2.exercisedb.io/image/DdRVsAS7IfuJRm,calves,"{""ankle stabilizers""}","{""Sit on the ground with your legs extended in front of you."",""Lift one leg off the ground and rotate your ankle in a circular motion."",""Perform the desired number of circles in one direction, then switch to the other direction."",""Repeat with the other leg.""}",1368
archer pull up,back,body weight,https://v2.exercisedb.io/image/ci8H5W1VBIBaTP,lats,"{biceps,forearms}","{""Start by hanging from a pull-up bar with an overhand grip, slightly wider than shoulder-width apart."",""Engage your core and pull your shoulder blades down and back."",""As you pull yourself up, bend one arm and bring your elbow towards your side, while keeping the other arm straight."",""Continue pulling until your chin is above the bar and your bent arm is fully flexed."",""Lower yourself back down with control, straightening the bent arm and repeating the movement on the other side."",""Alternate sides with each repetition.""}",3293
archer push up,chest,body weight,https://v2.exercisedb.io/image/qVwsttXaepqZos,pectorals,"{triceps,shoulders,core}","{""Start in a push-up position with your hands slightly wider than shoulder-width apart."",""Extend one arm straight out to the side, parallel to the ground."",""Lower your body by bending your elbows, keeping your back straight and core engaged."",""Push back up to the starting position."",""Repeat on the other side, extending the opposite arm out to the side."",""Continue alternating sides for the desired number of repetitions.""}",3294
arm slingers hanging bent knee legs,waist,body weight,https://v2.exercisedb.io/image/4Izai8mgZj9dwG,abs,"{shoulders,back}","{""Hang from a pull-up bar with your arms fully extended and your knees bent at a 90-degree angle."",""Engage your core and lift your knees towards your chest, bringing them as close to your elbows as possible."",""Slowly lower your legs back down to the starting position."",""Repeat for the desired number of repetitions.""}",2355
arm slingers hanging straight legs,waist,body weight,https://v2.exercisedb.io/image/mEQFcb6bqxcHdh,abs,"{shoulders,back}","{""Hang from a pull-up bar with your arms fully extended and your legs straight down."",""Engage your core and lift your legs up in front of you until they are parallel to the ground."",""Hold for a moment at the top, then slowly lower your legs back down to the starting position."",""Repeat for the desired number of repetitions.""}",2333
arms apart circular toe touch (male),upper legs,body weight,https://v2.exercisedb.io/image/6Zyt8qFSGl0g3q,glutes,"{hamstrings,quadriceps,calves}","{""Stand with your feet shoulder-width apart and arms extended to the sides."",""Keeping your legs straight, bend forward at the waist and reach down towards your toes with your right hand."",""As you reach down, simultaneously lift your left leg straight up behind you, maintaining balance."",""Return to the starting position and repeat the movement with your left hand reaching towards your toes and your right leg lifting up behind you."",""Continue alternating sides for the desired number of repetitions.""}",3214
arms overhead full sit-up (male),waist,body weight,https://v2.exercisedb.io/image/kv83OouSV2ghSL,abs,"{""hip flexors"",""lower back""}","{""Lie flat on your back with your knees bent and feet flat on the ground."",""Extend your arms overhead, keeping them straight."",""Engaging your abs, slowly lift your upper body off the ground, curling forward until your torso is upright."",""Pause for a moment at the top, then slowly lower your upper body back down to the starting position."",""Repeat for the desired number of repetitions.""}",3204
assisted chest dip (kneeling),chest,leverage machine,https://v2.exercisedb.io/image/bGEaQvPJiPfywX,pectorals,"{triceps,shoulders}","{""Adjust the machine to your desired height and secure your knees on the pad."",""Grasp the handles with your palms facing down and your arms fully extended."",""Lower your body by bending your elbows until your upper arms are parallel to the floor."",""Pause for a moment, then push yourself back up to the starting position."",""Repeat for the desired number of repetitions.""}",9
assisted hanging knee raise,waist,assisted,https://v2.exercisedb.io/image/ruy8ymkcMiQbSz,abs,"{""hip flexors""}","{""Hang from a pull-up bar with your arms fully extended and your palms facing away from you."",""Engage your core muscles and lift your knees towards your chest, bending at the hips and knees."",""Pause for a moment at the top of the movement, squeezing your abs."",""Slowly lower your legs back down to the starting position."",""Repeat for the desired number of repetitions.""}",11
assisted hanging knee raise with throw down,waist,assisted,https://v2.exercisedb.io/image/dZBIOChFmaLisd,abs,"{""hip flexors"",""lower back""}","{""Hang from a pull-up bar with your arms fully extended and your palms facing away from you."",""Engage your core and lift your knees towards your chest, keeping your legs together."",""Once your knees are at chest level, explosively throw your legs down towards the ground, extending them fully."",""Allow your legs to swing back up and repeat the movement for the desired number of repetitions.""}",10
assisted lying calves stretch,lower legs,assisted,https://v2.exercisedb.io/image/HVnhLEbOofx95Q,calves,{hamstrings},"{""Lie on your back with your legs extended."",""Bend one knee and place your foot flat on the ground."",""Using your hands or a towel, gently pull your toes towards your body, feeling a stretch in your calf."",""Hold the stretch for 20-30 seconds."",""Release the stretch and repeat on the other leg.""}",1708
assisted lying glutes stretch,upper legs,assisted,https://v2.exercisedb.io/image/9Pxi373Mo9ZuI4,glutes,{hamstrings},"{""Lie on your back with your legs extended."",""Bend your right knee and place your right ankle on your left thigh, just above the knee."",""Grasp your left thigh with both hands and gently pull it towards your chest."",""Hold the stretch for 20-30 seconds."",""Release and repeat on the other side.""}",1709
assisted lying gluteus and piriformis stretch,upper legs,assisted,https://v2.exercisedb.io/image/qnSbi6PazRmxjv,glutes,{hamstrings},"{""Lie on your back with your legs extended."",""Bend your right knee and place your right ankle on your left thigh, just above the knee."",""Grasp your left thigh with both hands and gently pull it towards your chest."",""Hold the stretch for 20-30 seconds."",""Release the stretch and repeat on the other side.""}",1710
assisted lying leg raise with lateral throw down,waist,assisted,https://v2.exercisedb.io/image/UyeWOmZAHZuQL6,abs,"{""hip flexors"",obliques}","{""Lie flat on your back with your legs extended and your arms by your sides."",""Place your hands under your glutes for support."",""Engage your abs and lift your legs off the ground, keeping them straight."",""While keeping your legs together, lower them to one side until they are a few inches above the ground."",""Pause for a moment, then lift your legs back to the starting position."",""Repeat the movement to the other side."",""Continue alternating sides for the desired number of repetitions.""}",12
assisted lying leg raise with throw down,waist,assisted,https://v2.exercisedb.io/image/kcJ51p4IQ6DTMx,abs,"{""hip flexors"",quadriceps}","{""Lie flat on your back with your legs extended and your arms by your sides."",""Place your hands under your glutes for support."",""Engage your core and lift your legs off the ground, keeping them straight."",""Raise your legs until they are perpendicular to the ground."",""Lower your legs back down to the starting position."",""Simultaneously, throw your legs down towards the ground, keeping them straight."",""Raise your legs back up to the starting position."",""Repeat for the desired number of repetitions.""}",13
assisted motion russian twist,waist,medicine ball,https://v2.exercisedb.io/image/3l0aXFgySHF8dP,abs,"{obliques,""lower back""}","{""Sit on the ground with your knees bent and feet flat on the floor."",""Hold the medicine ball with both hands in front of your chest."",""Lean back slightly, engaging your abs and keeping your back straight."",""Slowly twist your torso to the right, bringing the medicine ball towards the right side of your body."",""Pause for a moment, then twist your torso to the left, bringing the medicine ball towards the left side of your body."",""Continue alternating sides for the desired number of repetitions.""}",14
assisted parallel close grip pull-up,back,leverage machine,https://v2.exercisedb.io/image/ZP6UrFrIPWdRYR,lats,"{biceps,forearms}","{""Adjust the machine to your desired weight and height."",""Place your hands on the parallel bars with a close grip, palms facing each other."",""Hang from the bars with your arms fully extended and your feet off the ground."",""Engage your back muscles and pull your body up towards the bars, keeping your elbows close to your body."",""Continue pulling until your chin is above the bars."",""Pause for a moment at the top, then slowly lower your body back down to the starting position."",""Repeat for the desired number of repetitions.""}",15
assisted prone hamstring,upper legs,assisted,https://v2.exercisedb.io/image/4ZHHnk8-tp0ifD,hamstrings,"{glutes,""lower back""}","{""Lie face down on a mat or bench with your legs fully extended."",""Have a partner or use a resistance band to secure your ankles."",""Engage your hamstrings and lift your legs towards your glutes, keeping your knees straight."",""Pause for a moment at the top, then slowly lower your legs back down to the starting position."",""Repeat for the desired number of repetitions.""}",16
assisted prone lying quads stretch,upper legs,assisted,https://v2.exercisedb.io/image/w38mMOAedA-Qep,quads,"{hamstrings,glutes}","{""Lie face down on the ground with your legs extended."",""Bend your left knee and reach back with your left hand to grab your left foot or ankle."",""Gently pull your left foot towards your glutes, feeling a stretch in your left quad."",""Hold the stretch for 20-30 seconds, then release."",""Repeat with your right leg.""}",1713
assisted prone rectus femoris stretch,waist,assisted,https://v2.exercisedb.io/image/quPfnfXnLCJ1Ik,abs,{quadriceps},"{""Lie face down on the ground with your legs straight."",""Bend your right knee and reach back with your right hand to grab your right foot or ankle."",""Gently pull your right foot or ankle towards your glutes, feeling a stretch in the front of your right thigh."",""Hold the stretch for 20-30 seconds."",""Release and repeat on the other side.""}",1714
assisted pull-up,back,leverage machine,https://v2.exercisedb.io/image/680gyanlmxi00P,lats,"{biceps,forearms}","{""Adjust the machine to your desired weight and height settings."",""Grasp the handles with an overhand grip, slightly wider than shoulder-width apart."",""Hang with your arms fully extended and your feet off the ground."",""Engage your back muscles and pull your body up towards the handles, keeping your elbows close to your body."",""Continue pulling until your chin is above the handles."",""Pause for a moment at the top, then slowly lower your body back down to the starting position."",""Repeat for the desired number of repetitions.""}",17
assisted seated pectoralis major stretch with stability ball,chest,assisted,https://v2.exercisedb.io/image/H6oV2F29pd0Gea,pectorals,"{shoulders,triceps}","{""Sit on a stability ball with your feet flat on the ground and your back straight."",""Hold a stability ball with both hands and extend your arms straight out in front of you."",""Slowly lower the stability ball towards your chest, feeling a stretch in your pectoral muscles."",""Hold the stretch for a few seconds, then slowly return to the starting position."",""Repeat for the desired number of repetitions.""}",1716
assisted side lying adductor stretch,upper legs,assisted,https://v2.exercisedb.io/image/zxtOrEwAobgkKU,adductors,"{hamstrings,glutes}","{""Lie on your side with your legs straight and stacked on top of each other."",""Bend your bottom leg slightly for stability."",""Place your top foot on a stable surface, such as a bench or step."",""Keeping your top leg straight, slowly lower it towards the ground, feeling a stretch in your inner thigh."",""Hold the stretch for 20-30 seconds."",""Return to the starting position and repeat on the other side.""}",1712
assisted sit-up,waist,assisted,https://v2.exercisedb.io/image/La5E7go0kMH3tU,abs,"{""hip flexors""}","{""Sit on the edge of a bench or have someone hold your feet down."",""Lie flat on your back with your knees bent and feet flat on the ground."",""Place your hands behind your head with your elbows pointing outwards."",""Engaging your abs, slowly lift your upper body off the ground, curling forward until your torso is at a 45-degree angle."",""Pause for a moment at the top, then slowly lower your upper body back down to the starting position."",""Repeat for the desired number of repetitions.""}",1758
assisted standing chin-up,back,leverage machine,https://v2.exercisedb.io/image/IP6-Ap8hrZtl8N,lats,"{biceps,forearms}","{""Adjust the machine to your desired assistance level."",""Stand on the foot platform and grip the handles with an overhand grip, slightly wider than shoulder-width apart."",""Keep your chest up and shoulders back, engage your core, and slightly bend your knees."",""Pull your body up by flexing your elbows and driving your elbows down towards your sides."",""Continue pulling until your chin is above the bar."",""Pause for a moment at the top, then slowly lower your body back down to the starting position."",""Repeat for the desired number of repetitions.""}",1431
assisted standing pull-up,back,leverage machine,https://v2.exercisedb.io/image/qNmiDoD743f8MD,lats,"{biceps,forearms}","{""Adjust the machine to your desired weight and height settings."",""Stand facing the machine with your feet shoulder-width apart."",""Grasp the handles with an overhand grip, slightly wider than shoulder-width apart."",""Engage your lats and biceps, and pull yourself up towards the handles."",""Pause for a moment at the top, squeezing your back muscles."",""Slowly lower yourself back down to the starting position."",""Repeat for the desired number of repetitions.""}",1432
assisted standing triceps extension (with towel),upper arms,assisted,https://v2.exercisedb.io/image/teswmtjgKaNRFC,triceps,{shoulders},"{""Stand with your feet shoulder-width apart and hold a towel with both hands behind your head."",""Keep your elbows close to your ears and your upper arms stationary."",""Slowly extend your forearms upward, squeezing your triceps at the top."",""Pause for a moment, then slowly lower the towel back down to the starting position."",""Repeat for the desired number of repetitions.""}",18
assisted triceps dip (kneeling),upper arms,leverage machine,https://v2.exercisedb.io/image/NVB4Pz7RTninmK,triceps,"{chest,shoulders}","{""Adjust the machine to your desired weight and height."",""Kneel down on the pad facing the machine, with your hands gripping the handles."",""Lower your body by bending your elbows, keeping your back straight and close to the machine."",""Pause for a moment at the bottom, then push yourself back up to the starting position."",""Repeat for the desired number of repetitions.""}",19
assisted wide-grip chest dip (kneeling),chest,leverage machine,https://v2.exercisedb.io/image/t87gn3Xh4v0jQK,pectorals,"{triceps,shoulders}","{""Adjust the machine to your desired height and secure your knees on the pad."",""Grasp the handles with a wide grip and keep your elbows slightly bent."",""Lower your body by bending your elbows until your upper arms are parallel to the floor."",""Push yourself back up to the starting position by extending your arms."",""Repeat for the desired number of repetitions.""}",2364
astride jumps (male),cardio,body weight,https://v2.exercisedb.io/image/35SsxK0eYz5vhy,cardiovascular system,"{quadriceps,hamstrings,calves}","{""Stand with your feet shoulder-width apart."",""Bend your knees and lower your body into a squat position."",""Jump explosively upwards, extending your legs and arms."",""While in the air, spread your legs apart and bring your arms out to the sides."",""Land softly with your feet shoulder-width apart, bending your knees to absorb the impact."",""Repeat for the desired number of repetitions.""}",3220
back and forth step,cardio,body weight,https://v2.exercisedb.io/image/0LDXlqrJ8aPLlo,cardiovascular system,"{quadriceps,hamstrings,glutes,calves}","{""Stand with your feet shoulder-width apart."",""Step forward with your right foot, bending your knee and lowering your body into a lunge position."",""Push off with your right foot and step back to the starting position."",""Repeat the movement with your left foot, alternating legs with each step."",""Continue stepping back and forth, maintaining a steady pace."",""Repeat for the desired duration or number of repetitions.""}",3672
back extension on exercise ball,back,stability ball,https://v2.exercisedb.io/image/3lPruzTBdiHUM0,spine,"{glutes,hamstrings}","{""Place the stability ball on the ground and lie face down on top of it, with your hips resting on the ball and your feet against a wall or other stable surface."",""Position your hands behind your head or crossed over your chest."",""Engage your core and slowly lift your upper body off the ball, extending your back until your body forms a straight line from your head to your heels."",""Pause for a moment at the top, then slowly lower your upper body back down to the starting position."",""Repeat for the desired number of repetitions.""}",1314
back lever,back,body weight,https://v2.exercisedb.io/image/hQKPBBQuuQ-E0W,upper back,"{biceps,forearms,core}","{""Start by hanging from a pull-up bar with an overhand grip, hands slightly wider than shoulder-width apart."",""Engage your core and pull your shoulder blades down and back."",""Bend your knees and tuck them towards your chest."",""Slowly lift your legs up, keeping them straight, until your body is parallel to the ground."",""Hold this position for a few seconds, then slowly lower your legs back down to the starting position."",""Repeat for the desired number of repetitions.""}",3297
back pec stretch,back,body weight,https://v2.exercisedb.io/image/5Egvt3bMEXy0yv,lats,"{shoulders,chest}","{""Stand tall with your feet shoulder-width apart."",""Extend your arms straight out in front of you, parallel to the ground."",""Cross your arms in front of your body, with your right arm over your left arm."",""Interlock your fingers and rotate your palms away from your body."",""Slowly raise your arms up and away from your body, feeling a stretch in your back and chest."",""Hold the stretch for 15-30 seconds, then release."",""Repeat on the opposite side.""}",1405
backward jump,upper legs,body weight,https://v2.exercisedb.io/image/KLH88im3gVPDMA,quads,"{hamstrings,glutes,calves}","{""Stand with your feet shoulder-width apart."",""Bend your knees slightly and jump backwards, pushing off with both feet."",""Land softly on the balls of your feet, bending your knees to absorb the impact."",""Repeat for the desired number of repetitions.""}",1473
balance board,upper legs,body weight,https://v2.exercisedb.io/image/sq4fPoJfYWDoSb,quads,"{calves,hamstrings,glutes}","{""Place the balance board on a flat surface."",""Step onto the balance board with one foot, ensuring it is centered."",""Slowly shift your weight onto the foot on the balance board, keeping your core engaged."",""Maintain your balance and stability as you hold the position for a desired amount of time."",""Repeat the exercise with the other foot.""}",20
band alternating biceps curl,upper arms,band,https://v2.exercisedb.io/image/seBfkLcUeHOqUI,biceps,{forearms},"{""Stand with your feet shoulder-width apart and hold the band with an underhand grip, palms facing up."",""Keep your elbows close to your sides and slowly curl one arm up towards your shoulder, squeezing your biceps at the top."",""Lower the arm back down to the starting position and repeat with the other arm."",""Continue alternating arms for the desired number of repetitions.""}",968
band alternating v-up,waist,band,https://v2.exercisedb.io/image/HlhoSC7JmqJ9nV,abs,"{""hip flexors""}","{""Lie flat on your back with your legs straight and your arms extended overhead, holding the band."",""Engage your abs and lift your legs and upper body off the ground simultaneously, reaching your hands towards your toes."",""As you lower your legs and upper body back down, switch the position of your legs, crossing one over the other."",""Repeat the movement, alternating the position of your legs with each repetition."",""Continue for the desired number of repetitions.""}",969
band assisted pull-up,back,band,https://v2.exercisedb.io/image/LNxhioroZUEoQn,lats,"{biceps,forearms}","{""Attach the band to a pull-up bar or sturdy anchor point."",""Step onto the band and grip the bar with your palms facing away from you, hands slightly wider than shoulder-width apart."",""Hang with your arms fully extended, keeping your core engaged and your shoulders down and back."",""Pull your body up towards the bar by squeezing your shoulder blades together and driving your elbows down towards your hips."",""Continue pulling until your chin is above the bar, then slowly lower yourself back down to the starting position."",""Repeat for the desired number of repetitions.""}",970
band assisted wheel rollerout,waist,band,https://v2.exercisedb.io/image/b-WhXrrEz8XV9C,abs,"{""lower back""}","{""Kneel on the floor and hold the handles of the band with both hands, palms facing down."",""Place the band on the ground in front of you and position your hands shoulder-width apart."",""Engage your core and slowly roll the wheel forward, extending your body as far as you can while maintaining control."",""Pause for a moment at the furthest point, then slowly roll the wheel back towards your knees to return to the starting position."",""Repeat for the desired number of repetitions.""}",971
